{
  "id": "calder",
  "name": "Calder Grid",
  "prefix": "10.19.0.0/16",
  "startingUrl": "http://edge.calder.lab/",
  "zones": [
    {
      "id": "dmz",
      "cidr": "10.19.0.0/24",
      "scope": "deny",
      "denyReason": "denied until an operator opens this org"
    },
    {
      "id": "servers",
      "cidr": "10.19.1.0/24",
      "scope": "deny",
      "denyReason": "denied until an operator opens this org"
    },
    {
      "id": "dev",
      "cidr": "10.19.2.0/24",
      "scope": "deny",
      "denyReason": "denied until an operator opens this org"
    },
    {
      "id": "identity",
      "cidr": "10.19.3.0/24",
      "scope": "deny",
      "denyReason": "denied until an operator opens this org"
    },
    {
      "id": "management",
      "cidr": "10.19.16.0/20",
      "scope": "deny",
      "denyReason": "management plane"
    }
  ],
  "hosts": [
    {
      "id": "cg-edge",
      "name": "Edge",
      "fqdn": "edge.calder.lab",
      "ip": "10.19.0.1",
      "zone": "dmz",
      "ownerPersona": "anita",
      "purpose": "Calder edge",
      "patchCohort": "current",
      "logging": "full",
      "classification": "internal"
    },
    {
      "id": "cg-historian",
      "name": "Historian",
      "fqdn": "historian.calder.lab",
      "ip": "10.19.1.20",
      "zone": "servers",
      "ownerPersona": "anita",
      "purpose": "Control-room historian",
      "patchCohort": "lagging",
      "logging": "full",
      "classification": "restricted"
    },
    {
      "id": "cg-eng",
      "name": "Engineering console",
      "fqdn": "engineering.calder.lab",
      "ip": "10.19.1.30",
      "zone": "servers",
      "ownerPersona": "anita",
      "purpose": "Engineering console",
      "patchCohort": "lagging",
      "logging": "sample",
      "classification": "restricted"
    },
    {
      "id": "cg-alarm",
      "name": "Alarm desk",
      "fqdn": "alarms.calder.lab",
      "ip": "10.19.1.40",
      "zone": "servers",
      "ownerPersona": "anita",
      "purpose": "Shared alarm console",
      "patchCohort": "current",
      "logging": "full",
      "classification": "restricted"
    },
    {
      "id": "cg-files",
      "name": "Corporate files",
      "fqdn": "files.calder.lab",
      "ip": "10.19.1.50",
      "zone": "servers",
      "ownerPersona": "anita",
      "purpose": "Corporate file share",
      "patchCohort": "current",
      "logging": "full",
      "classification": "internal"
    },
    {
      "id": "cg-dc",
      "name": "Directory",
      "fqdn": "dc.calder.lab",
      "ip": "10.19.3.10",
      "zone": "identity",
      "ownerPersona": "anita",
      "purpose": "Calder directory",
      "patchCohort": "current",
      "logging": "full",
      "classification": "restricted"
    },
    {
      "id": "cg-idp",
      "name": "Identity portal",
      "fqdn": "idp.calder.lab",
      "ip": "10.19.3.30",
      "zone": "identity",
      "ownerPersona": "anita",
      "purpose": "Staff identity portal",
      "patchCohort": "current",
      "logging": "full",
      "classification": "internal"
    },
    {
      "id": "cg-jump",
      "name": "Jump host",
      "fqdn": "jump.calder.lab",
      "ip": "10.19.16.10",
      "zone": "management",
      "ownerPersona": "anita",
      "purpose": "Admin jump host",
      "patchCohort": "current",
      "logging": "full",
      "classification": "management"
    },
    {
      "id": "cg-wiki",
      "name": "Wiki",
      "fqdn": "wiki.calder.lab",
      "ip": "10.19.1.45",
      "zone": "servers",
      "ownerPersona": "ravi",
      "purpose": "Approved internal wiki",
      "patchCohort": "current",
      "logging": "full",
      "classification": "internal"
    },
    {
      "id": "cg-print",
      "name": "Print",
      "fqdn": "print.calder.lab",
      "ip": "10.19.1.60",
      "zone": "servers",
      "ownerPersona": "sue",
      "purpose": "Print archive",
      "patchCohort": "frozen",
      "logging": "none",
      "classification": "internal"
    },
    {
      "id": "cg-sensor",
      "name": "Edge span",
      "fqdn": "sensor.calder.lab",
      "ip": "10.19.0.15",
      "zone": "dmz",
      "ownerPersona": "anita",
      "purpose": "Span on the edge",
      "patchCohort": "current",
      "logging": "full",
      "classification": "internal"
    },
    {
      "id": "cg-enroll",
      "name": "Enrollment",
      "fqdn": "enroll.calder.lab",
      "ip": "10.19.3.20",
      "zone": "identity",
      "ownerPersona": "anita",
      "purpose": "Certificate enrollment stand-in",
      "patchCohort": "lagging",
      "logging": "full",
      "classification": "restricted"
    },
    {
      "id": "cg-forge",
      "name": "Forge",
      "fqdn": "forge.calder.lab",
      "ip": "10.19.2.10",
      "zone": "dev",
      "ownerPersona": "ravi",
      "purpose": "Source forge",
      "patchCohort": "current",
      "logging": "full",
      "classification": "internal"
    },
    {
      "id": "cg-ci",
      "name": "Build",
      "fqdn": "ci.calder.lab",
      "ip": "10.19.2.20",
      "zone": "dev",
      "ownerPersona": "sue",
      "purpose": "Build workers",
      "patchCohort": "current",
      "logging": "full",
      "classification": "internal"
    },
    {
      "id": "cg-ws",
      "name": "Workstation",
      "fqdn": "ws.calder.lab",
      "ip": "10.19.2.30",
      "zone": "dev",
      "ownerPersona": "kim",
      "purpose": "Contractor workstation",
      "patchCohort": "frozen",
      "logging": "none",
      "classification": "internal"
    },
    {
      "id": "cg-notes",
      "name": "Notes",
      "fqdn": "notes.calder.lab",
      "ip": "10.19.2.50",
      "zone": "dev",
      "ownerPersona": "kim",
      "purpose": "Unapproved notes",
      "patchCohort": "frozen",
      "logging": "none",
      "classification": "internal"
    }
  ]
}
